{
  "schema_version": "1.0",
  "startup": {
    "name": "MaktabAI",
    "tagline": "AI-наставник для школьников, который помогает закрывать пробелы в знаниях.",
    "stage": "Pre-seed"
  },
  "founder": {
    "name": "Алина Каримова",
    "role": "CEO",
    "background": "10 лет в edtech, запускала B2C-продукты для подготовки к экзаменам и управляла командой из 24 человек."
  },
  "summary": "MaktabAI строит персональный слой обучения поверх школьной программы: диагностирует пробелы, объясняет темы и формирует короткие задания.",
  "traction": [
    "2 400 активных учеников в пилоте за 8 недель.",
    "Retention week 4: 41% среди учеников 8-9 классов.",
    "Подписаны LOI с 6 частными школами."
  ],
  "market": {
    "segment": "Дополнительное школьное образование",
    "size": "$8B+ в целевых регионах",
    "insight": "Родители платят за репетиторов, но хотят более частый и дешевый формат поддержки."
  },
  "risks": [
    "Доказать устойчивую конверсию из пилота в платную подписку.",
    "Снизить стоимость проверки ответов без потери качества.",
    "Выстроить доверие школ к AI-рекомендациям."
  ]
}
